{
  "version": "0.1",
  "created_at": "2026-06-22T00:00:00+00:00",
  "ragflow_base_url": "https://ragflow.example.invalid",
  "dataset": {
    "id": "example-dataset-id",
    "name": "kb:example"
  },
  "profile": {
    "id": "default-en-768",
    "language": "en",
    "chunk_method": "naive"
  },
  "documents": [
    {
      "document_id": "example-document-id",
      "source_path": "source.pdf",
      "markdown_path": "documents/source.md",
      "status": "parsed",
      "chunk_count": 3
    }
  ]
}
